{
  "issue": "ISSUE 032",
  "date": "2026.09.29",
  "thesis": "过去24小时没有出现带完整业务分母的新披露，本期因此纳入一项真实产品漏洞的实质更新，以及三项此前未覆盖、带生产流量或成对对照的同行评审研究。共同信号是：高价值企业AI并不一定来自更大的生成模型，而常来自更窄的控制点——隔离端点配置、在索引阶段消除跨域干扰、让安全Agent按证据选择工具，以及把模型刷新限制在可审计的硬规则内。",
  "takeaways": [
    "Muse漏洞让本地恶意程序借用Agent权限，Meta数小时内发布补丁",
    "ServiceNow只在索引时增加领域前缀，400多个客户实例CTR提高4.2%",
    "钓鱼检测Agent每周处理约6万个高风险URL，仍需第三方确认恶意结论",
    "信贷模型刷新由14.3天降至1.1天，但公平性仍留给人工合规审查"
  ],
  "contrarian": "四项材料把Agent风险放在四个不同位置：Muse说明执行权限可能从端点配置旁路进入；ServiceNow在模型调用前改善索引表示，避免为每个租户复制模型；MemoPhishAgent允许动态工具选择，却把恶意结论交给独立验证；ACRM则让Agent探索数据与训练策略，但用确定性稳定性规则和双人签字隔离最终发布。共同原则不是减少Agent，而是让每个自治决策都有独立控制面和可验证终点。 证据分母同样不能混用。Muse只有概念验证和补丁，没有真实利用率；前缀检索有400多个实例的随机A/B，但CTR不是业务解决率；钓鱼系统公布每周流量和开放代码，却未披露实际误封成本；信贷刷新给出18次成对比较和76次回测，但公平性仍在系统之外。上线验收应同时记录质量增益、异常路径、人工复核成本和最终业务损害，而不能用点击、召回或周期缩短中的任何一个指标代表整体可靠性。",
  "items": [
    {
      "type": "独立安全研究＋真实产品漏洞与修复＋端点权限边界",
      "source": "2026年9月22日｜The Verge、Reuters、Meta",
      "title": "Muse漏洞让本地恶意程序借用Agent权限，Meta数小时内发布补丁",
      "summary": "这是9月23日简报所述Muse人工接管试点的实质更新。安全研究者Patrick Wardle发现，macOS版Muse允许其他本地应用修改未公开设置，并把云端语音转录请求重定向至攻击者端点；概念验证随后借用Muse既有能力拍照和写入恶意文件，部分动作没有向用户告警。Meta在报道发布数小时内修补漏洞，并强调攻击前提是恶意代码已经在用户账户下运行。",
      "design": "已披露的攻击链不是远程提示注入：本地恶意进程先修改Muse配置，将转录服务指向自有端点，由此操纵Agent会话并调用它已获准的摄像头或文件能力。问题跨越应用设置、云端转录和Agent工具三层；隔离虚拟机与密码保险库并未覆盖本地控制面。补丁内容、配置签名、调用再授权和会话撤销机制未公开。企业桌面Agent应把服务端点设为不可由普通应用修改，高风险动作重新绑定用户在场确认；完整性异常时停止会话、撤权并保留轨迹。",
      "evidence": "确认事实： Wardle完成概念验证，The Verge核实可重定向转录并触发拍照、文件写入；Meta确认已发布热修复。厂商判断： 因攻击要求同一用户账户下已有恶意代码，实际风险较低。编辑判断： 这一前提降低远程攻击概率，却不消除“低权限恶意程序借Agent扩大能力”的混淆代理风险。尚未证明： 没有CVE编号、受影响版本、真实受害者、遥测命中数、账户数据读取范围或补丁后的复测结果；概念验证也不能推算线上利用率。现有证据证明端点配置可成为Agent权限旁路，不能证明云端隔离整体失效。",
      "idea": "为一个桌面Agent建立“配置完整性门”：固定API端点、工具清单和应用签名，摄像头、外发与文件写入逐次显示调用者及目标；配置变化立即断开会话。以未授权配置修改、权限借用成功率、告警覆盖、撤权秒数、补丁回归和正常任务误阻率验收。",
      "url": "https://www.theverge.com/tech/998679/meta-muse-patch-zero-day-exploit-ai-agent",
      "relatedLinks": [
        {
          "label": "Reuters产品发布与权限背景",
          "url": "https://www.reuters.com/business/meta-launches-ai-agent-that-can-access-other-apps-send-emails-make-payments-2026-09-08/"
        }
      ],
      "image": {
        "src": "/cases/sep29-muse-vulnerability.png",
        "alt": "Muse本地权限漏洞报道配图",
        "caption": "The Verge报道配图：Muse端点配置漏洞及其被修补的背景。"
      }
    },
    {
      "type": "ACL同行评审行业论文＋多租户企业检索部署＋四周随机A/B",
      "source": "2026年7月｜ServiceNow；ACL 2026 Industry Track",
      "title": "ServiceNow只在索引时增加领域前缀，400多个客户实例CTR提高4.2%",
      "summary": "ServiceNow处理多租户搜索中的小而常见问题：同一共享Embedding模型面对IT、HR、法律和产品资料时，语义相近但领域不同的文档会互相污染。团队没有为每个客户微调模型，而在索引时给各数据源文档增加8–15词的领域描述，例如“IT服务管理知识文章”。方法已覆盖18种语言、400多个客户实例，无需修改在线查询链路，四周A/B中点击率提高4.2%。",
      "design": "离线管线为每个数据源选择前缀：数据政策允许时，从5–20篇样本文档生成候选；禁止外部模型处理时由领域专家填写；两者均不可用则由fastText从覆盖18种语言的30项标准库中分类。前缀与正文拼接后由冻结的指令型双编码器生成向量，查询只编码一次，继续跨多个数据源检索；原有租户索引和访问控制不变。系统先Shadow两周，再从10%逐步增至50%流量并全量发布。论文未披露前缀审批、陈旧检测、回滚时限及无结果后的人工路径。",
      "evidence": "生产证据： 离线集含42个客户实例、187个数据源和1万条标注查询；最佳前缀使Hit@5由0.796升至0.851。四周A/B覆盖400多个实例、1,200多个数据源，CTR由62.3%升至64.9%，空结果率由8.7%降至8.2%，均达到`p<0.01`；查询P50几乎不变，为46.2对46.4毫秒。500题人工评测中，RAG答案正确率提高4.7–5.6个百分点。局限： 约8%的初始前缀过窄，扩大样本后仍约3%；普通BERT类编码器反而下降0.3–0.8点，小于50篇的语料增益不足1%。没有任务解决率、权限错误、用户时间节省和跨平台复现，点击也不等于答案正确。",
      "idea": "为跨部门知识库选择IT、HR和采购三个数据源，索引时分别加入经负责人批准的短前缀；在线查询、ACL和生成模型保持不变。以跨域污染率、Hit@5、空结果率、答案引用正确率、索引耗时、前缀陈旧率及每千次查询成本验收。",
      "url": "https://aclanthology.org/2026.acl-industry.149/",
      "relatedLinks": [
        {
          "label": "完整PDF、A/B与失败模式",
          "url": "https://aclanthology.org/2026.acl-industry.149.pdf"
        }
      ],
      "image": {
        "src": "/cases/sep29-servicenow-prefix.jpg",
        "alt": "ServiceNow多租户检索论文首页",
        "caption": "ACL论文首页：索引阶段领域前缀改善多租户检索效果。"
      }
    },
    {
      "type": "ACL同行评审行业论文＋开源多模态Agent＋生产安全部署",
      "source": "2026年7月｜ACL 2026 Industry Track",
      "title": "钓鱼检测Agent每周处理约6万个高风险URL，仍需第三方确认恶意结论",
      "summary": "MemoPhishAgent面向社交平台中短链、嵌套跳转和托管页面等难判URL，不再按固定顺序运行所有检测器。Agent可根据当前证据选择抓取正文、检查截图、提取深层目标、分析图像或搜索外部信息，并从相似历史调查中复用工具轨迹。系统生产中每周分析约6万个定向高风险URL，报告召回率91.44%；判为恶意的候选仍送第三方安全服务核验，而不是直接把模型结论视为真值。",
      "design": "输入URL先进入ReAct循环，五类工具以Pydantic Schema验证参数，调用失败可重试或降级；Agent输出恶意／正常、0–5置信度和一句理由。记忆库保存关键词、完整工具序列及最终判断：无近邻时执行全套调查，部分匹配时把旧轨迹作为示例，充分匹配时对历史结果多数投票。页面判恶意后进入第三方验证与专家标注链。资料未说明生产中是否自动封禁、工具网络权限、最大轮数、超时预算和申诉恢复；历史标签污染仍依赖遗忘与噪声测试控制。",
      "evidence": "开放与生产证据： SocPhish由五个平台六个月抓取的2,765个URL组成，含516个钓鱼样本，经第三方服务及三名分析员多数票标注；Agent准确率96.57%、精确率92.57%、召回91.44%，去掉记忆后召回降至63.69%。500例注入测试中，召回由0.90降至0.88，但准确率由0.96降至0.86。单URL实验时延4.46秒，生产规模约每周6万条。局限： 生产召回数字与作者构建的SocPhish评测紧密相关，并非独立线上审计；没有真实误封、漏检损失、第三方复核成本、模型调用费用或处置时延。攻击者被假定不能篡改检测管线和记忆，不能覆盖内部威胁及记忆投毒。",
      "idea": "为企业邮件网关建立高风险URL复核器：静态规则先筛选，Agent仅调查灰区并保存证据轨迹；恶意结论经独立扫描器或安全人员确认后才封禁。以召回、精确率、人工复核量、注入后性能、平均工具次数、处置时延和每个确认威胁成本验收。",
      "url": "https://aclanthology.org/2026.acl-industry.84/",
      "relatedLinks": [
        {
          "label": "完整PDF、消融与生产指标",
          "url": "https://aclanthology.org/2026.acl-industry.84.pdf"
        },
        {
          "label": "开源实现",
          "url": "https://github.com/XuanChen-xc/MemoPhishAgent"
        }
      ],
      "image": {
        "src": "/cases/sep29-memophish-agent.jpg",
        "alt": "MemoPhishAgent钓鱼检测论文首页",
        "caption": "ACL论文首页：MemoPhishAgent以工具选择和记忆轨迹调查高风险URL。"
      }
    },
    {
      "type": "ACL同行评审行业论文＋银行内网多Agent部署＋模型风险Human-in-the-loop",
      "source": "2026年7月｜ACL 2026 Industry Track",
      "title": "信贷模型刷新由14.3天降至1.1天，但公平性仍留给人工合规审查",
      "summary": "ACRM处理信贷模型发生数据漂移后的刷新流程：过去资深数据科学家需反复重建样本、筛选特征、训练和核查，通常持续数周。系统以Qwen‑32B编排六个专用Agent，检索历史成功轨迹并受稳定性硬规则约束，只生成候选模型和完整推理记录，不参与个人授信决定。三个月18次成对刷新中，平均周期由人工14.3天降至1.1天，14次无需中途人工干预，全部上线仍须高级建模师与合规人员签字。",
      "design": "监控服务在KS衰减超过0.03时触发刷新；编排器读取KS、PSI和特征统计，从约1,200条历史轨迹检索三个相似案例，再决定调用样本选择、特征选择、确定性过滤、训练策略、模型评估或解释Agent。规则层在执行前检查PSI等不可突破的边界，违规计划最多重新生成两次；每步状态、动作和结果写入本地轨迹库。系统运行于隔离的8×A100集群，候选模型通过全部检查后交人审；冲突规则或未见漂移转高级建模师处理，现有模型继续服务。",
      "evidence": "生产对照： 六类场景各发生三次刷新，每次同时交给ACRM和资深团队，共18组成对比较；人工平均14.3天，规则加检索5.2天，完整系统1.1天。ACRM相对人工的KS提高0.005、PSI降低0.026；另以时间切分回测76次历史漂移，方向一致且`p<0.001`。14次自动收敛，4次因新型漂移或规则冲突由人用2–4小时解决。重要局限： 只有单一匿名机构和三个月观察，客户、资产规模、错误审批、资本损失与运维成本未公开；公平性指标尚未进入Agent硬规则，只在下游人工审查。全部作者侧证据无法证明长期月度刷新不会累积偏差或轨迹记忆污染。",
      "idea": "为逾期预测模型做“候选刷新器”：Agent只调整时间窗、样本和既有特征，公平性、稳定性及数据量由代码硬检；模型卡与Diff经建模负责人、合规人员双签后发布。以刷新周期、规则冲突、人工小时、PSI、群体差异、回滚时间和单次刷新成本验收。",
      "url": "https://aclanthology.org/2026.acl-industry.65/",
      "relatedLinks": [
        {
          "label": "完整PDF、18次成对刷新与审计机制",
          "url": "https://aclanthology.org/2026.acl-industry.65.pdf"
        }
      ],
      "image": {
        "src": "/cases/sep29-acrm-credit-risk.jpg",
        "alt": "ACRM信贷模型刷新论文首页",
        "caption": "ACL论文首页：ACRM以确定性规则约束信贷模型刷新流程。"
      }
    }
  ],
  "projectIdeas": [
    {
      "title": "Agent Control-Plane Integrity Gate",
      "description": "为桌面或安全Agent固定服务端点、工具清单、网络目标和签名配置；任何变化先停机，再由独立验证器检查会话与已执行动作。以配置旁路、权限借用、撤权时延、日志覆盖、误停和恢复时间形成发布门。",
      "tags": [
        "端点完整性",
        "权限边界",
        "运行时控制"
      ]
    },
    {
      "title": "Bounded Adaptive Operations Loop",
      "description": "选择URL复核或模型刷新这一窄任务，让Agent只在可枚举工具内探索，并保存状态—动作—结果轨迹；确定性规则拦截严重项，独立系统或双人审批确认最终动作。以任务质量、自动覆盖、规则冲突、人工小时、严重漏报和单位合格结果成本验收。",
      "tags": [
        "自适应运维",
        "规则约束",
        "人工审批"
      ]
    }
  ],
  "contentHash": "7f6f181fe1c272d7"
}
