{
  "issue": "ISSUE 030",
  "date": "2026.09.27",
  "thesis": "过去24小时缺少带可核验分母的新生产披露，本期因此选取四项此前未覆盖的部署与评测研究。它们共同划出一条可靠边界：模型适合解释异构证据、寻找长文档线索或选择规则路径，但资产状态、数值计算和最终业务结果仍应由确定性组件确认。模拟环境可以降低Agent评测成本，却不能替代真实系统的事务验证与人工抽审。",
  "takeaways": [
    "工业维护Agent把单资产证据整合压到15–30秒，但只提供建议",
    "AgenticRAG把金融问答正确率做到92%，代价是7.8倍Token",
    "PayPal用“代理状态”评测多轮Agent，但目标完成判断的人机一致率仅82.7%",
    "旅游定价把计算权移出LLM，3,960笔订单未出现致命数值错误"
  ],
  "contrarian": "四项材料把“模型判断”和“业务真值”分得更清楚。工业维护系统先用确定性方法构造证据，再让模型解释；AgenticRAG允许模型自主找证据，却以查询路由和Token预算限制成本；PayPal模拟环境用代理状态快速比较模型，但承认它不是确定性数据库；旅游定价则把所有数值执行彻底移出LLM，只保留离散选择权。它们共同表明，自治程度不应按工具数量定义，而应按模型能够改变哪些业务状态来分级。 证据层级也不能混用：维护与旅游案例有真实部署分母，但效果主要由部署团队报告；AgenticRAG提供完整开放基准，却仍停留在预生产；代理状态评测经过同行评审和人工校准，但目标完成一致率低于幻觉标签，且全部场景为合成。最稳健的工程原则是：模型负责解释、检索和候选选择，外部系统负责权限、当前状态、数值及事务结果；模拟评委用于扩大测试覆盖，真实终态和抽样人审用于决定上线。",
  "items": [
    {
      "type": "ACL同行评审行业论文＋生产CMMS部署＋确定性验证与Human-in-the-loop",
      "source": "2026年7月｜IBM、Imperial College London；ACL 2026 Industry Track",
      "title": "工业维护Agent把单资产证据整合压到15–30秒，但只提供建议",
      "summary": "Condition Insight Agent面向设备维护人员，将工单文本、低频传感器指标、告警、资产资料和FMEA故障知识汇成可审计证据包，再由领域模型解释当前状态并提出维修建议。它不直接控制设备或创建工单，而把原本散落在CMMS、楼宇管理和IoT平台中的证据提前整理好。系统已覆盖约1,500项资产、16类设备和14个站点，单资产处理由人工约20–30分钟降至15–30秒。",
      "design": "确定性管线先归一资产字段，汇总症状、干预和结果，按指标类型识别漂移、重置、异常速率及持续偏离，再用语义匹配将历史工单关联到FMEA故障模式。LLM只能读取生成的`asset_facts`，输出Normal、Needs Attention或Not Enough Data以及带依据的建议；平行规则引擎依据未结工单、紧急维修、告警和指标异常复算状态，两者不一致时修订或压制结论。输出进入CMMS供人员排序和复核，不自动触发维护动作；权限、超时和失败恢复细节未披露。",
      "evidence": "生产证据： 部署横跨约1,500项资产、16类和14个站点，稀疏证据会被保守标为Not Enough Data。对照证据： 直接输入原始数据时，无依据主张率为21.4%、高具体性率20%；结构化证据将其分别改善至0.3%和66%。加入受约束提示后，状态与确定性规则的一致率由70%升至91%，但无依据主张率略升至0.8%。局限： 20–30分钟人工基线来自从业者讨论，并非计时对照；论文未报告人员数量、建议接受率、故障漏报、停机减少或投资回报，核心评价还依赖Claude与GPT评委。结果证明证据结构和规则门能改善输出，不能证明维修结果已改善。",
      "idea": "为一个机房的泵或电机建立只读“状态卡”：整合近90天工单、三类指标和既有故障表，模型只写证据化摘要，规则状态冲突或数据不足即转工程师。以无依据主张、规则一致率、单资产复核分钟数、人工推翻率、漏报故障和每次有效建议成本验收。",
      "url": "https://aclanthology.org/2026.acl-industry.50/",
      "relatedLinks": [
        {
          "label": "完整PDF与部署指标",
          "url": "https://aclanthology.org/2026.acl-industry.50.pdf"
        }
      ],
      "image": {
        "src": "/cases/sep27-industrial-maintenance.jpg",
        "alt": "工业维护Agent论文首页",
        "caption": "ACL论文首页：工业维护Agent将工单、传感器指标与FMEA故障知识整理为可审计证据包。"
      }
    },
    {
      "type": "Microsoft预印本＋开放企业RAG基准＋预生产架构实验",
      "source": "2026年5月7日｜Microsoft",
      "title": "AgenticRAG把金融问答正确率做到92%，代价是7.8倍Token",
      "summary": "AgenticRAG没有重建企业搜索索引，而是在现有搜索之上增加四个工具：跨库搜索、文档内查找、分段打开和上下文摘要。推理模型可反复改写查询、进入候选文件并判断证据是否足够，而不是被首次检索结果锁定。它在长文档检索、企业支持和财务问答三个公开基准上明显优于单轮RAG，但成本随文档长度和迭代轮数上升，适合复杂问题路由而非全部查询默认启用。",
      "design": "Agent最多运行15轮；`search`一次可提交五个改写查询并各取最多10条结果，`find`在指定文档中定位模式，`open`按最多1,800行窗口读取全文。会话保存引用ID和Token账本，达到128K上下文的90%时预警，触顶后强制摘要并只保留指定证据。模型生成正文即结束，轮数耗尽则依据已有资料强制作答。架构称可沿用现有文档访问控制，但未披露用户级权限测试、索引删除传播、低证据拒答或人工升级；预生产方案建议只把复杂、多意图问题路由至该链路。",
      "evidence": "开放评测： BRIGHT含861题、5,650份平均约16K Token的长文档，最佳Recall@1为49.6%，较最佳Embedding基线高21.8点；WixQA的200题上事实性为0.96，基线为0.85；FinanceBench含150题、84份平均约140页的文件，答案正确率92%，接近提供真实证据的94%上限。成本： BRIGHT平均每题52.3K Token，为单轮搜索的2.6倍；FinanceBench为114.8K，对照14.7K，即7.8倍。局限： 仍是预印本和离线基准，生产流量、时延、权限错误、用户采纳及单位货币成本均未公开，且最终正确性部分依赖评委模型。",
      "idea": "为财务政策库建立复杂度路由：单事实问题走固定RAG，跨文件比较或表格追踪才进入最多六轮的AgenticRAG；每次回答必须保留文件与页码，超预算或证据冲突即拒答。以答案正确率、引用正确率、无效工具轮、P95时延、每个正确答案Token及人工查找分钟数验收。",
      "url": "https://arxiv.org/abs/2605.05538",
      "relatedLinks": [
        {
          "label": "HTML全文、消融与成本表",
          "url": "https://arxiv.org/html/2605.05538v1"
        }
      ],
      "image": {
        "src": "/cases/sep27-agentic-rag.jpg",
        "alt": "AgenticRAG论文首页",
        "caption": "论文首页：AgenticRAG在现有企业搜索之上加入多轮检索工具，并评估准确率与Token成本。"
      }
    },
    {
      "type": "ACL同行评审行业论文＋多轮工具模拟环境＋Agent训练与评委校准",
      "source": "2026年7月｜PayPal AI；ACL 2026 Industry Track",
      "title": "PayPal用“代理状态”评测多轮Agent，但目标完成判断的人机一致率仅82.7%",
      "summary": "PayPal提出Proxy State-Based Evaluation，用LLM模拟用户、账户和电商工具，并从完整轨迹推断结构化“代理状态”，从而评估Agent是否真正完成充值、退款、购物查询等目标，而不必先构建完整测试数据库。场景同时声明用户事实、系统事实、期望终态和期望回复，允许多条正确路径。该环境还能生成带奖励的训练轨迹，但状态与评委仍由模型推断，不能称为确定性真值。",
      "design": "208个合成场景被分为157个训练和51个测试场景，每题最多十轮。Reasoning Agent调用账户、电商或面向用户三类接口；用户模拟器依据目标、事实和Persona回复，工具模拟器读取系统事实及当前代理状态后返回JSON，状态跟踪器在每次调用后更新余额、购物车或争议等字段。两个评委分别检查终态完成及工具／用户幻觉。失败轨迹可用于诊断，成功轨迹用于SFT或拒绝采样训练。该环境不连接真实账本、IAM或资金事务，生产发布仍需确定性回放与人工抽检。",
      "evidence": "评测证据： 每个测试场景独立运行十次；Qwen3‑30B基线目标完成率65.64%，用强模型成功轨迹SFT后达77.34%，五轮以上长会话由42.75%升至69.44%。默认模拟器的工具和用户幻觉率分别为1.33%和0.67%；较弱状态模型使工具幻觉升至3.61%。人工校准： 50段对话中，两名专家与LLM在工具、用户幻觉上的三方一致率均为94.7%，但目标完成仅82.7%；另50个中间状态的正确率为92%。局限： 场景全为合成，测试集仅51题；同类模型同时模拟、追踪和裁决，可能共享偏差，不能替代真实数据库终态检查。",
      "idea": "为退款Agent建立30个代理状态场景：记录原余额、订单状态、授权条件和期望终态，模型评委先筛选版本，再对全部高风险失败和10%放行样本进行数据库回放。以终态正确率、评委—人工一致率、状态跟踪错误、错误退款、每题评测成本及回归耗时验收。",
      "url": "https://aclanthology.org/2026.acl-industry.87/",
      "relatedLinks": [
        {
          "label": "完整PDF、训练规模与人工校准",
          "url": "https://aclanthology.org/2026.acl-industry.87.pdf"
        }
      ],
      "image": {
        "src": "/cases/sep27-paypal-proxy-state.jpg",
        "alt": "PayPal代理状态评测论文首页",
        "caption": "ACL论文首页：PayPal以代理状态和模拟工具评估多轮Agent目标完成情况。"
      }
    },
    {
      "type": "ACL同行评审行业论文＋六个月生产部署＋自然语言政策编译",
      "source": "2026年7月｜Eastern Institute of Technology；ACL 2026 Industry Track",
      "title": "旅游定价把计算权移出LLM，3,960笔订单未出现致命数值错误",
      "summary": "该系统为市属国有旅游企业处理不断变化的门票、住宿、交通和团队政策。LLM把PDF、表格或即时通信订单转成结构化字段，并把自然语言定价条款编译为可编辑条件树；运行时只选择资源、规则树和离散路径，单价、单位换算与总价均由确定性引擎执行。六个月覆盖七个景区、12类业务和1,000余项有效政策，处理3,960笔订单，平均处理时间由约10分钟降至不足2分钟。",
      "design": "离线阶段先OCR或解析政策文件，模型把资源映射到受控目录，提取客户范围、有效期、条件和叶节点价格，再组装满足“一路径一价格规格”的条件树。验证器检查Schema完整性、单位兼容、非负值和路径冲突，失败树禁止发布并转人员；经理可在控制台Diff、编辑和批准。在线阶段从订单截图提取日期、人数及资源，元数据先路由候选树，LLM只选路径，计算引擎生成报价。L1路径、L2树和L3资源或产品均可由操作员覆盖，最终确认后进入订单流程。",
      "evidence": "生产证据： 2025年下半年共3,960笔订单，其中3,842笔为截图；团队由15–20人降至3人，政策上线由约20分钟降至1分钟。信息一致的1,349笔订单包含2,598个产品实例，单位正确率100%、路径对应单价准确率85.2%，致命数值错误为0。重要反证： 全量截图订单中47.9%仍需L3资源编辑，另2.8%需切换组合产品，说明上游订单与实际行程经常不一致。局限： 正确率是在已排除资源、规则树及关键字段冲突的子集上计算，不能代表端到端准确率；仅有一个部署地点，人员缩减和效率调查均由团队自报，也未给出财务损失或客户投诉。",
      "idea": "为会议服务报价做窄原型：只支持场地、餐饮和设备三类资源，把十份政策编译成经理可审条件树；LLM只能选择路径，金额由代码计算，资源冲突必须人工确认。以政策上线分钟数、路径准确率、资源编辑率、致命数值错误、单单处理时间和人工覆盖率验收。",
      "url": "https://aclanthology.org/2026.acl-industry.114/",
      "relatedLinks": [
        {
          "label": "完整PDF、生产漏斗与界面流程",
          "url": "https://aclanthology.org/2026.acl-industry.114.pdf"
        }
      ],
      "image": {
        "src": "/cases/sep27-travel-pricing.jpg",
        "alt": "旅游定价Agent论文首页",
        "caption": "ACL论文首页：旅游定价系统由模型选择规则路径，确定性引擎负责金额计算。"
      }
    }
  ],
  "projectIdeas": [
    {
      "title": "Evidence Packet Maintenance Assistant",
      "description": "选一个资产类别，将工单、指标和故障表转换为版本化证据包；LLM只输出引用明确的状态摘要，规则冲突或资料不足即标记Not Enough Data。以无依据主张、规则一致率、人工复核时间、推翻率和故障漏报形成上线门。",
      "tags": [
        "维护证据",
        "确定性验证",
        "人工复核"
      ]
    },
    {
      "title": "Bounded Decision Compiler",
      "description": "选报价、补贴或费用报销的一类窄政策，把自然语言条款转成可审条件树；模型只做字段抽取与离散路径选择，金额和状态写入由确定性代码执行。代理状态环境负责日常回归，真实沙箱终态和人工抽审负责发布，以致命错误、路径准确率、覆盖率和单位处理成本验收。",
      "tags": [
        "政策编译",
        "规则执行",
        "回归评测"
      ]
    }
  ],
  "contentHash": "24d39ebcffd9ff85"
}
