{
  "issue": "ISSUE 034",
  "date": "2026.10.01",
  "thesis": "本期纳入一项9月30日正式上线的安全Agent，以及三项此前未覆盖、带开放评测或生产数据的研究。四组材料分别回答：Agent调查结果能否被审计、相同准确率需要多少人工兜底、客户投诉能否提前暴露系统故障，以及多模态推断是否真正减少物流损失。共同判断是，企业应把模型能力转化为“可靠性—人工负担—成本—业务损失”的联合指标，而不是用平均响应时间或离线准确率单独决定上线。",
  "takeaways": [
    "Sekoia让Agent调查每条安全告警，厂商称平均99秒出具可审计结论",
    "两个准确率只差0.3点的Agent，达到同一可靠性却相差9.6点人工复核",
    "TingIS每天处理30万条客户反馈，三条投诉即可聚合出风险事件",
    "商品重量VLM把准确率由约37%升至71%，物流收入流失下降22%"
  ],
  "contrarian": "四组材料对应从“模型输出”到“可运营系统”的四个关键分母。Elevate记录每次查询和人工覆盖，却尚未公开误判；READY证明相近准确率可能对应完全不同的审核负担；TingIS用规则、业务元数据和阈值把大流量压缩为少量告警；Meesho则用每单收入流失验证模型是否改善真实业务。平均准确率、响应时间和采用规模都不足以单独代表可部署性。 值得复制的不是某个模型，而是四种机制：为每项自动判断保存可检查证据；把人工复核视为有容量和成本的策略；先用规则、索引及业务状态缩小模型工作面；最后用下游损失而非代理分数验收。证据强度仍有明显差异：两项ACL案例有真实生产数字但数据不可复现，READY开放方法却尚未执行真实人工路径，Sekoia的最新规模与提速主要是厂商自报。扩容前仍需独立抽审、错误严重度和端到端成本。",
  "items": [
    {
      "type": "新产品正式上线＋独立新闻核验＋真实早期访问数据＋Human-on-the-loop",
      "source": "2026年9月30日｜Sekoia、Reuters",
      "title": "Sekoia让Agent调查每条安全告警，厂商称平均99秒出具可审计结论",
      "summary": "Sekoia正式开放Elevate：新告警到达后，Agent无需等待分析师便收集日志、威胁情报和上下文，判断真阳性或假阳性，并输出置信度、证据和调查轨迹。厂商称早期访问覆盖逾2,000家客户，完成超过42.5万次调查，平均99秒给出结论；欧美服务商报告总体调查时间最高缩短五倍。价值在于把重复取证自动化，同时把最终判断和覆盖权保留给分析师。",
      "design": "检测规则触发告警后，Elevate读取该规则专属Runbook，其中列明检测目标、正常解释和调查问题；Agent只查询客户已接入的事件源，结合Sekoia威胁情报形成逐项Finding，再生成结论、置信度和自然语言说明。分析师能查看每条查询、结果和耗时，修改Runbook并覆盖结论；AI计算留在Sekoia基础设施。月度运行额度耗尽后停止分析新告警，失败动作会在Trace中标记，但重试、超时、误判升级以及后续响应动作的审批边界未完整公开。",
      "evidence": "确认事实： Reuters核实产品正式上线、约2,000家早期访问客户及可接入不同模型和工具的定位。厂商数据： 42.5万次调查、平均99秒出具结论和最高五倍提速均来自Sekoia；产品文档确认每个结论可被分析师覆盖，Trace仅保存30天。尚未证明： 没有告警总量、真实威胁分母、漏报率、误报率、严重错误、分析师修改率或单位成本，也未说明五倍提速来自多少服务商和何种基线。现有材料证明系统已在真实环境执行调查，不能证明它降低了安全事故或总体SOC成本。",
      "idea": "为单一身份异常规则建立只读调查Agent：自动查询登录日志、资产和威胁情报，输出证据化结论，但封号或隔离必须由分析师批准。以平均调查分钟数、结论覆盖率、分析师推翻率、严重漏报、每条告警查询数、单位成本和Trace完整率验收。",
      "url": "https://www.reuters.com/legal/litigation/frances-sekoia-rolls-out-ai-cybersecurity-platform-its-clients-2026-09-30/",
      "relatedLinks": [
        {
          "label": "正式发布与早期访问数据",
          "url": "https://www.globenewswire.com/news-release/2026/09/30/3371800/0/en/sekoia-elevate-brings-autonomous-cyber-defense-to-life-from-security-data-to-verdict-in-99-seconds.html"
        },
        {
          "label": "调查方法文档",
          "url": "https://docs.sekoia.com/xdr/features/modules/elevate_investigation_method/"
        },
        {
          "label": "完整动作追踪文档",
          "url": "https://docs.sekoia.com/xdr/features/modules/elevate_traces/"
        }
      ],
      "image": {
        "src": "/cases/oct01-sekoia-elevate.jpg",
        "alt": "SEKOIA.IO安全调查平台界面",
        "caption": "SEKOIA.IO图形调查界面示例；用于呈现告警调查平台环境。"
      }
    },
    {
      "type": "新开放评估框架＋医疗审计案例＋人工监督成本资格化",
      "source": "2026年9月2日｜Scale AI、Vanderbilt University Medical Center等",
      "title": "两个准确率只差0.3点的Agent，达到同一可靠性却相差9.6点人工复核",
      "summary": "READY不再只问Agent独立答对多少题，而是问它在何种人工复核政策下，能以多大成本达到业务要求的可靠性。框架先定义具体流程的成功条件，再从开发集选择满足可靠性目标的最低成本监督策略，冻结后用留出数据资格化。临床审计案例中，两个系统的自主准确率为72.8%和72.5%，但达到76%可靠性分别需要复核39.2%和29.6%的案例。",
      "design": "使用方声明任务总体、工具环境、结果与过程成功条件、可靠性目标、人工能力及成本模型。各Agent在代表性案例上运行，保存最终产物、引用、工具调用和置信信号；开发集据此搜索“自动接受或转人工”的阈值策略。策略一经选定便冻结，再在未参与选择的案例上计算可靠性置信下界、人工覆盖和运行成本，不达标则不予资格化。案例中的人工介入发生在报告完成后；实时澄清、执行中纠正、权限和异常恢复只在框架中定义，尚未进行大规模实证。",
      "evidence": "开放实验： 16个系统在750个临床审计案例上产生12,000次运行，留出资格集为375例；结果按95%置信下界判断是否达到76%目标。72.8%与72.5%的两个系统所需复核率相差9.6个百分点，说明模型能否把错误集中到低置信案例会直接改变人工成本。关键假设： 主实验没有真实执行复核，而是假设人工复核成功率、时延和成本；该假设变化会改变所需覆盖率。数据仅来自回顾性医疗审计和终点转人工策略，没有生产漂移、审核疲劳、权限事件或患者结果，因此它证明了资格化方法，而非任何Agent已经适合医疗部署。",
      "idea": "为发票合规或客服退款审计建立200例历史资格集：先定义结果正确、证据齐全及无越权三项成功条件，再冻结转人工阈值并用独立留出集验证。以可靠性下界、人工复核率、复核成功率、单案分钟数、单位合格结果成本和漂移后再资格化次数验收。",
      "url": "https://arxiv.org/abs/2609.02095",
      "relatedLinks": [
        {
          "label": "HTML全文、完整实验与局限",
          "url": "https://arxiv.org/html/2609.02095"
        },
        {
          "label": "完整PDF",
          "url": "https://arxiv.org/pdf/2609.02095"
        }
      ],
      "image": {
        "src": "/cases/reliable-agent-deployment.jpg",
        "alt": "READY企业Agent部署资格论文首页",
        "caption": "论文首页：READY将Agent可靠性、人工监督负担与成本共同纳入部署资格评估。"
      }
    },
    {
      "type": "ACL同行评审行业论文＋金融科技生产部署＋LLM与确定性规则混合系统",
      "source": "2026年7月｜蚂蚁集团、上海交通大学；ACL 2026 Industry Track",
      "title": "TingIS每天处理30万条客户反馈，三条投诉即可聚合出风险事件",
      "summary": "TingIS利用客户投诉和热线记录补足指标、日志与Trace未发现的故障：系统从每分钟最高2,000条嘈杂消息中提取“主体＋问题”，把同一根因的少量描述合并成持续事件，再按业务线路由并抑制重复告警。一个月生产运行中，系统每天处理逾30万条反馈，高优先级事件发现率为95%，P90告警时间3.5分钟，说明用户声音可以成为可操作的早期监控信号。",
      "design": "规则先滤掉情绪、泛咨询等低信号内容，Qwen3‑8B把有效消息压缩成无PII的“主体＋问题”，BGE‑M3生成向量；级联路由结合业务代码、关键词和重排器确定责任域。域内先以LSH聚类，Kimi‑K2只处理无法由相似度阈值直接归并的簇，并通过持久事件状态决定关联旧事件、新建事件或丢弃噪声。知识库、统计阈值和行为规则进一步降噪，最终高置信告警交SRE验证。身份权限、原文保留、错误路由申诉、模型超时和事件关闭后的恢复流程未披露。",
      "evidence": "生产证据： 一个月内日均处理逾30万条、峰值每分钟2,000条，高优先级发现率95%，P90告警3.5分钟；约29条日告警由SRE确认。离线对照： 回放集中，降噪把告警从512条压至29条且未降低检测率；事件聚合B³‑F1为0.826，误合并率21.5%，DBSCAN则为64.3%。规则预筛每天去除约20万条，整链每天使用约800万Token。局限： 数据集、事件总数和根因标签不公开，全部核心结果由部署方报告；21.5%的误合并仍可能误导根因分析，也没有MTTR、漏掉的一般事件、人工工时或损失避免额。",
      "idea": "为支付或登录服务建立“客户反馈盲区监控”：只覆盖一个业务域，三条语义相近反馈形成候选事件，低置信路由和所有首发告警由SRE确认。以高优先级发现率、首次信号分钟数、误合并、事件碎片、每日告警量、人工确认时间和每个有效告警Token验收。",
      "url": "https://aclanthology.org/2026.acl-industry.147/",
      "relatedLinks": [
        {
          "label": "HTML全文、消融与成本分析",
          "url": "https://arxiv.org/html/2604.21889"
        },
        {
          "label": "完整PDF",
          "url": "https://aclanthology.org/2026.acl-industry.147.pdf"
        }
      ],
      "image": {
        "src": "/cases/oct01-tingis-feedback.jpg",
        "alt": "TingIS客户反馈风险事件识别论文首页",
        "caption": "ACL论文首页：TingIS从大量客户反馈中聚合根因事件并抑制重复告警。"
      }
    },
    {
      "type": "ACL同行评审行业论文＋多模态生产部署＋可验证物流收益",
      "source": "2026年7月｜Meesho；ACL 2026 Industry Track",
      "title": "商品重量VLM把准确率由约37%升至71%，物流收入流失下降22%",
      "summary": "Meesho处理的是商品页面未可靠填写重量、但物流计费又依赖重量的具体问题。系统把重量离散成计费桶，让视觉语言模型同时读取商品图片、标题和描述，并按品类真实重量分布检索历史样例作为上下文。在四个高方差品类的生产试点中，桶准确率由约37%升至71%，低估两档以上的比例由约40%降至5%，平均每单物流收入流失下降约22%。",
      "design": "输入包括图片、文本及最细商品类目。历史商品先按已交付订单量筛选，将高销量商品的既有重量作为软标签；检索器再按该类目各重量桶的经验分布分配50个示例，避免上下文被少数极轻或极重商品支配。Gemini 2.5 Flash读取交错图文示例和待预测商品，输出离散重量桶，进入计费或物流流程；若类目没有合格历史样本则使用备用示例集。论文报告存在弃权指标，但未公开低置信转人工阈值、抽样称重、模型超时、错误计费申诉及个人或商家权限边界。",
      "evidence": "同行评审证据： 14个高方差品类的离线实验中，完整方案准确率73.81%，高于Top‑5 KNN的42.28%和随机示例的65.50%；允许误差两档时为85.43%。Gemini 1.5 Pro仅升至74.23%，成本约2.57倍；GPT‑4o为73.89%，成本约5.15倍。生产数据： 四个品类、每日数百万商品中，准确率约37%升至71%，低估率约70%降至34%，收入流失下降22%。局限： 线上是前后对比而非随机试验，未披露观察周期、商品及订单分母、绝对金额、真实称重覆盖和申诉损害；软标签还假设高销量商品重量更可信。",
      "idea": "为仓储团队选择一个重量或包装尺寸波动大的品类，先以影子模式预测计费桶，并随机称重5%商品；高风险低估只生成复核任务，不直接改价。以精确桶准确率、严重低估率、抽检偏差、商家申诉、每单物流损失、P95时延和每万件推理成本验收。",
      "url": "https://aclanthology.org/2026.acl-industry.41/",
      "relatedLinks": [
        {
          "label": "完整PDF、离线消融与线上结果",
          "url": "https://aclanthology.org/2026.acl-industry.41.pdf"
        },
        {
          "label": "OpenReview入口",
          "url": "https://openreview.net/forum?id=5CeC1vhpzF"
        }
      ],
      "image": {
        "src": "/cases/oct01-meesho-weight.jpg",
        "alt": "Meesho商品重量预测论文首页",
        "caption": "ACL论文首页：Meesho以商品图文和历史样例预测物流计费重量桶。"
      }
    }
  ],
  "projectIdeas": [
    {
      "title": "Reliability–Review Qualification Gate",
      "description": "选择安全告警或合规审计这一窄流程，定义结果、证据和权限三项成功条件；在开发集选择最低人工成本的转交阈值，冻结后用留出集资格化。以可靠性下界、严重漏报、人工覆盖、复核推翻率、处理分钟数和每个合格结论成本决定上线。",
      "tags": [
        "可靠性资格化",
        "人工复核",
        "成本控制"
      ]
    },
    {
      "title": "Business-Loss Shadow Pilot",
      "description": "选择投诉聚类或商品重量估计，先在影子模式运行，规则处理明确案例，模型只处理语义或视觉灰区；人员抽检自动结果并记录真实损失。以发现提前量、严重错误、人工队列、单位推理成本、申诉率和每单或每事件净损失决定是否扩大流量。",
      "tags": [
        "影子运行",
        "业务指标",
        "损失核算"
      ]
    }
  ],
  "contentHash": "9f49d6d5e2fb6249"
}
