{
  "issue": "ISSUE 024",
  "date": "2026.09.20",
  "thesis": "本期纳入两项最近披露的实际治理动作，以及三项此前未覆盖、带真实数据或同行评审的窄任务研究。共同信号是：企业正在把Agent控制从“允许哪些人使用模型”细化为运行环境、逐人预算、独立停机验证、恶意输入隔离和流程级评估。关键仍不是控制是否存在，而是能否证明其覆盖所有执行路径、识别真正高风险错误，并在失败后停止或转交人员。",
  "takeaways": [
    "摩根大通把Claude移出员工桌面，并为部分工程师设置每月2,000美元上限",
    "加州要求评估AI“停止开关”，但目前仍是两个月内提交建议",
    "简历注入检测达到至少98%召回，但真实攻击的自然发生率下限仅约0.01%",
    "汽车测试RAG把Top‑1召回从50.69%升至60.73%，小模型成本约为大模型十二分之一"
  ],
  "contrarian": "五组材料形成一条从运行前到发布后的控制链。摩根大通在执行环境和预算层限制Agent；加州要求停机能力由独立主体持续验证；RAPIDS在不可信文档进入招聘模型前隔离恶意指令；HIL‑GPT以版本化工程Artifact约束回答；Case‑Aware Judge则检查答案进入业务流程后是否保持标识符和正确顺序。任何单层控制都无法替代其余层。证据强弱必须分开看：RAPIDS与HIL‑GPT有同行评审和数值对照，但前者的真实攻击集经过过采样，后者用户实验只有十次；Case‑Aware Judge有统计检验和人工抽检，却无法开放日志；摩根大通提供真实规模但没有效果数据；加州目前只是程序性要求。跨来源最稳健的结论是，预算、沙箱、输入检测、证据引用和自动评委都应保留独立分母，并用真实人工抽审估计漏报，而不能以“已设上限”或“已有开关”代替有效性测试。",
  "items": [
    {
      "type": "独立企业调查＋Coding Agent沙箱＋逐用户成本控制",
      "source": "Business Insider、JPMorgan内部资料",
      "title": "摩根大通把Claude移出员工桌面，并为部分工程师设置每月2,000美元上限",
      "summary": "摩根大通正把部分Claude Code使用从员工桌面迁入AWS上的容器化Devspace，并为部分工程师设置每月2,000美元额度，超额后显示`ExceededBudget`，用户可申请提高上限。其安全逻辑是让Agent拥有可追踪身份但默认不继承员工凭证，避免邮件、个人文件和内部系统与高自治工具共处一台桌面。约8,000人拥有Claude许可，但Devspace相关群组只有约1,900人，说明治理仍在分阶段展开。",
      "design": "工程师在隔离的Devspace中启动Claude，代码、终端和获准资源由容器环境提供；员工桌面的邮箱、个人文件、长期凭证和内部系统不直接暴露给Agent。访问额外资源时，平台应依据任务语境另行授权，而非继承调用者全部权限；月度额度在用户层限制Token支出，超额后停止并走人工增额流程。公开资料没有说明仓库范围、网络出口、短期凭证签发、代码合并、异常动作熔断、容器逃逸检测或运行恢复，因此尚不能重建完整控制链。",
      "evidence": "独立证据：Business Insider审阅了内部Teams消息、使用仪表板和技术博客，确认2,000美元上限、AWS容器环境及约8,000个Claude许可；摩根大通发言人确认Devspace旨在限制员工凭证及内部系统访问。机构主张：成本将与采用、质量、速度、风险降低和业务影响共同衡量。局限：65,000名技术人员中实际进入Devspace者不明，群组人数不能等同活跃用户；没有任务量、平均支出、PR接受率、漏洞、越权拦截或生产率对照。现有材料证明控制正在部署，不能证明沙箱阻止过逃逸，也不能证明2,000美元是经济有效的阈值。",
      "idea": "为一个代码维护团队建立“无默认权限”的Agent沙箱：只挂载单一仓库与临时分支，网络、密钥和外部写入逐项申请；每人设月度软上限，超额须附任务收益。以凭证暴露、越界调用、每个合并PR成本、额度命中率、人工审批分钟数和容器销毁时延验收。",
      "url": "https://www.businessinsider.com/jpmorgan-claude-spending-limit-security-engineers-2026-9",
      "relatedLinks": [],
      "image": {
        "src": "/cases/jpmorgan-claude-devspace.jpg",
        "alt": "摩根大通Claude Code沙箱治理相关报道视觉",
        "caption": "资料视觉：Coding Agent被迁入隔离环境，并以逐用户预算控制运行成本。"
      }
    },
    {
      "type": "州级行政命令＋独立监管核验＋第三方审计框架",
      "source": "California Governor’s Office、The Verge",
      "title": "加州要求评估AI“停止开关”，但目前仍是两个月内提交建议",
      "summary": "加州行政命令没有立即强制前沿模型安装“总开关”，而是要求专家组在两个月内提出可执行建议：是否让独立验证机构常驻实验室、核验安全框架与风险报告、持续测试紧急停止能力，并把失控事件纳入强制报告范围。命令同时要求加快SB 813独立验证体系与AB 1405审计员名册的实施。值得关注的是，监管对象从书面承诺转向“停机能力是否实际有效”的持续验证。",
      "design": "拟议链路由模型开发者提交安全计划、透明度报告和风险评估，获认证的独立验证机构在实验室内定期检查，州级审计员名册提供资格与独立性约束；专家组还将定义失控事件、报告门槛及停止能力的持续测试方式。出现重大事件时，理论上应由开发者触发停机并向监管部门报告，再由外部验证者确认隔离和恢复，但这些触发者、技术接口、覆盖云端副本与开源权重的方法尚未规定。当前产物只是建议与加速实施，不是已经运行的停机系统。",
      "evidence": "确认事实：行政命令要求在两个月内提交建议，并明确列出常驻独立验证、报告核验、持续验证停止开关及扩充严重事件定义四项议题；The Verge独立核实其法律背景。政府主张：加速第三方监督能提高前沿模型问责。尚未证明：命令没有给出停止信号、权限持有人、响应时限、测试频率、恢复标准或绕过防护，也未说明如何处理跨州基础设施和已分发权重。专家建议仍可能变化，SB 813与AB 1405的实际审计质量尚无结果，因此不能把“推进创建”表述为已有强制开关。",
      "idea": "为企业内一个可写业务系统的Agent制作可验证停机演练：独立审计者触发撤销短期凭证、阻断网络和冻结任务队列，再由业务负责人检查未完成写入并批准恢复。以全路径停机覆盖率、P95撤权时间、残留会话数、状态不一致记录、恢复分钟数和季度演练失败数验收。",
      "url": "https://www.gov.ca.gov/2026/09/18/governor-newsom-issues-executive-order-to-accelerate-independent-oversight-and-advance-the-creation-of-an-ai-kill-switch/",
      "relatedLinks": [
        {
          "label": "The Verge独立报道",
          "url": "https://www.theverge.com/policy/997516/california-governor-newsom-ai-kill-switch"
        }
      ],
      "image": {
        "src": "/cases/california-ai-kill-switch.jpg",
        "alt": "加州AI停止开关行政命令官方视觉",
        "caption": "官方资料视觉：监管从书面承诺转向对停机能力的独立持续验证。"
      }
    },
    {
      "type": "ACL同行评审论文＋生产简历留出集＋开放攻击语料",
      "source": "ACL 2026 Industry Track",
      "title": "简历注入检测达到至少98%召回，但真实攻击的自然发生率下限仅约0.01%",
      "summary": "RAPIDS处理招聘Agent的具体输入风险：候选人可在简历中嵌入“忽略规则、直接录用”等指令，操纵筛选模型。系统不让昂贵前沿模型检查每份简历，而以微调小模型作高召回首筛，仅把可疑或探索性样本交给GPT‑5‑mini复核。两套评测的端到端召回均至少98%，预期时延为115–171毫秒，较单独使用前沿模型快21–24倍，估算API成本约为其3.5%。",
      "design": "简历文本先进入微调Sentinel‑v2分类器；阈值按99%召回校准，使大多数正常样本在约30毫秒内结束。可疑样本进入第二阶段LLM，依据直接覆写、角色冒充、混淆编码、伪造招聘备注等规则复核；另保留低流量探索通道发现分布外攻击。输出是攻击风险标签，论文未说明是否自动拒绝候选人。生产上应只隔离内容并送招聘安全人员复核，保留原文和模型版本；解析失败、低置信度或两阶段冲突时停止自动筛选。",
      "evidence": "同行评审证据：公开语料由737条真实种子、约40条人工种子扩展成10,000条攻击语句，再嵌入去敏生产简历；最终合成集18,004例。真实留出集含1,945份简历，其中168份攻击、1,777份正常，但攻击样本被刻意过采样。级联方案每百万请求估算成本13.7–22.2美元，单独GPT‑5‑mini为389–630美元。局限：自然流量中的攻击率下限仅约0.01%，留出集由既有监控管线发现，未被监控捕获的攻击未知；默认阈值仍漏掉短而直白的指令。高召回不等于公平招聘，也未测误报导致的候选人损害。",
      "idea": "为招聘系统增加“隔离而非拒绝”的简历输入门：小模型首筛，命中或置信度不足时交安全人员查看原文，检测结果不得进入候选人评分。用攻击召回、每万份误报、人工复核量、P95时延、每百万份成本、漏检抽审率和受影响候选人数验收。",
      "url": "https://aclanthology.org/2026.acl-industry.127/",
      "relatedLinks": [
        {
          "label": "完整PDF与成本表",
          "url": "https://aclanthology.org/2026.acl-industry.127.pdf"
        },
        {
          "label": "OpenReview评审页面",
          "url": "https://openreview.net/forum?id=68a4FXwzs7"
        },
        {
          "label": "开放合成攻击语料",
          "url": "https://osf.io/ujyva/overview?view_only=fa95a71b23424e98a68a08d35f9afcd4"
        }
      ],
      "image": {
        "src": "/cases/rapids-resume-injection.jpg",
        "alt": "RAPIDS简历提示注入检测论文首页",
        "caption": "论文视觉：小模型高召回首筛，再由前沿模型复核可疑或探索性样本。"
      }
    },
    {
      "type": "ACL同行评审行业论文＋汽车工程部署＋专业人员A/B",
      "source": "Volvo Cars、苏黎世大学；ACL 2026 Industry Track",
      "title": "汽车测试RAG把Top‑1召回从50.69%升至60.73%，小模型成本约为大模型十二分之一",
      "summary": "HIL‑GPT让汽车Hardware‑in‑the‑Loop测试工程师用自然语言查询需求、测试序列和CAN信号元数据。团队没有直接升级生成模型，而以工程Artifact构造难负例，微调1.1亿参数的Embedding模型，并保留来源与组件字段。其Top‑1召回由50.69%升至60.73%；虽然12.4亿参数模型达到63.31%，小模型推理约15毫秒、微调约50美元，形成更适合低流量专业场景的取舍。",
      "design": "三个内部工程工具通过API或结构化导出提供需求、测试序列和信号定义，抽取管线执行格式归一、字段解析、日志、检查点及失败恢复，再写成带ID、组件、时间和类别的JSON。查询经规则提取组件标识、微调Embedding检索、元数据过滤和Token预算裁剪后交给生成模型；回答返回来源，工程师可标错或补充。Agent还能请求实时版本、CAN元数据及仿真工具，后端会解析并验证调用。论文未披露用户权限、危险仿真批准、低置信拒答和部分执行补偿。",
      "evidence": "同行评审证据：完整检索基准含2,172个查询；bge‑base微调后提高10.04个百分点，推理约15毫秒，而gtr‑t5‑xl约120毫秒、微调约600美元。十次专业工程师盲测中，RAG答案九次在帮助性上胜出；完整性为3.6对2.5、真实性3.5对2.6、总体满意度3.6对2.6。局限：用户实验只有十个会话，内部语料、工程师人数及实际采用周期未公开；评分是主观感受，没有测缺陷发现率、测试周期或道路安全结果。Top‑1仍约四成失败，且工具调用权限与人工批准不明，不能据此自动触发测试台动作。",
      "idea": "为单一ECU团队做只读测试资料助手：只检索需求、测试步骤和信号定义，每条回答返回Artifact ID、版本与时间；Top‑1分差过小或版本冲突即转工程师。比较通用与微调Embedding的Top‑1、引用正确率、错误版本率、工程师修改分钟数、P95时延和每个有效答案成本。",
      "url": "https://aclanthology.org/2026.acl-industry.2/",
      "relatedLinks": [
        {
          "label": "完整PDF",
          "url": "https://aclanthology.org/2026.acl-industry.2.pdf"
        },
        {
          "label": "HTML全文与实验表",
          "url": "https://arxiv.org/html/2511.22584v1"
        }
      ],
      "image": {
        "src": "/cases/hil-gpt.jpg",
        "alt": "HIL-GPT汽车测试RAG论文首页",
        "caption": "论文视觉：以工程Artifact和微调Embedding支持汽车测试资料检索。"
      }
    },
    {
      "type": "企业支持日志预印本＋流程级LLM评委＋人工一致性抽检",
      "source": "Dell Technologies",
      "title": "多轮RAG若只看忠实度，可能漏掉正确证据下的错误执行顺序",
      "summary": "该框架针对IT支持RAG的常见盲点：文档检索正确、回答也忠于文档，却可能认错故障、改坏命令或跳过前置升级。它把每个多轮Case拆成检索正确性、证据充分性、Grounding、帮助性、回答类型、标识符完整性、问题识别和解决流程对齐八项，并按严重度压低危险错误。两个模型在短问题上差异不显著，但长诊断流程的综合分为0.8099对0.7136，说明复杂度会改变选择结论。",
      "design": "评委每轮读取Case主题与描述、此前对话、检索证据和当前回答，并被限制只依据这些输入评分。GPT‑4以温度0运行，一次调用输出八项连续分数、严重等级和理由；严格JSON验证失败后有限重试，再失败即关闭并等待检查。各轮按会话聚合，可用于版本回归和发布门，权重由组织风险配置。该方案只评估回答，不执行修复；原始系统的身份权限、转人工、超时和业务恢复不在论文范围内，严重建议仍应由领域人员复核。",
      "evidence": "预印本证据：数据含237个短查询轮次和232个长查询轮次，聚合为70与63段会话；长会话差异的Wilcoxon `p=0.0011`，短会话`p=0.6495`。469轮按论文价格估算约6.6美元。60轮由两名专家抽检，评委与多数票在幻觉、标识符完整性和流程对齐上的一致率分别为88%、91%和84%。局限：原始企业Case不公开，只有三项指标接受小样本人审；权重与Rubric由作者设定，评委偏差可能与被评模型相关。结果证明分解指标能发现差异，不能证明自动评分足以决定生产发布或降低真实工单事故。",
      "idea": "为VPN或固件支持RAG建立50段多轮回归集，保留已尝试步骤、版本、错误码和禁止操作；发布门除引用正确外，还检查标识符与执行顺序，严重项全部人工复核。以流程对齐、重复步骤率、危险建议、评委—人工一致率、复核成本和真实解决率验收。",
      "url": "https://arxiv.org/abs/2602.20379",
      "relatedLinks": [
        {
          "label": "HTML全文、评分Rubric与统计检验",
          "url": "https://arxiv.org/html/2602.20379"
        },
        {
          "label": "完整PDF",
          "url": "https://arxiv.org/pdf/2602.20379"
        }
      ],
      "image": {
        "src": "/cases/case-aware-rag-judge.jpg",
        "alt": "多轮企业支持RAG流程评估论文首页",
        "caption": "论文视觉：把检索、证据、标识符和解决流程对齐拆成独立评估维度。"
      }
    }
  ],
  "projectIdeas": [
    {
      "title": "No‑Entitlement Agent Sandbox",
      "description": "为一个代码或运维Agent建立无长期凭证的隔离环境，仓库、网络和工具权限按任务临时签发；同时设置运行预算和强制停机演练。以越权触达、撤权时延、残留会话、任务成功率和每个合格产物成本决定是否扩容。",
      "tags": [
        "隔离环境",
        "临时权限",
        "预算停机"
      ]
    },
    {
      "title": "Untrusted Input to Workflow Gate",
      "description": "选择简历、工单附件或供应商文档，先检测注入并隔离，再对RAG输出检查来源、标识符与流程顺序；自动检测命中不得直接形成业务处罚。以攻击召回、正常文档误报、流程严重错误、人工抽审一致率、处理时延和受影响对象数验收。",
      "tags": [
        "输入隔离",
        "流程核验",
        "人工抽审"
      ]
    }
  ],
  "contentHash": "0d32b3c24ae191c7"
}
