{
  "issue": "ISSUE 025",
  "date": "2026.09.21",
  "thesis": "过去24小时缺少带结果分母的新生产部署，本期因此只纳入一项近期CRM模型试点及三项此前未覆盖的开放研究。四项材料都指向“执行前资格化”：CRM Agent要学会等待而非抢先写入，优化Agent应先补齐业务约束，语音Agent需按付款方动态选择路径，权限过滤器则必须识别具体违反哪条政策。单看最终成功率，会掩盖静默假设、错误拒绝和错误执行顺序。",
  "takeaways": [
    "Salesforce用“抢先写入即零奖励”训练CRM模型，但客户仍只处于试点",
    "优化Agent能减少静默假设，但完整补齐约束需平均追问十次",
    "医疗IVR提示迁移达到82.21%，但证据仍是受控逐轮评测",
    "自然语言政策过滤最高准确率仅55.11%，不能独立充当权限门"
  ],
  "contrarian": "四项材料把“何时可以行动”拆成了四种不同资格。Koa训练模型在缺少用户确认时延迟写入；OR‑Clarify要求业务目标与约束达到可建模状态；IVR系统依赖当前菜单与付款方成功路径；政策过滤器则试图在主Agent看到请求前判断其是否允许。它们共同说明，Agent的停止或继续不能只由一个通用置信分数决定，而应绑定具体状态：字段是否齐全、动作是否可逆、路径是否验证、政策是否明确。\n证据同样揭示成本转移。OR‑Clarify用更多问题换取更少静默假设；IVR用聚类和RAG降低提示维护，却仍有约18%的逐轮错误；Koa的训练门提升函数调用，但没有生产事故分母；政策过滤甚至在最高配置下也只有55.11%准确率。最可靠的架构因此是把确定性规则放在权限和不可逆动作前，把模型用于缺口发现与语义匹配，并为低置信度保留人工恢复，而不是再增加一个拥有最终批准权的“监督Agent”。",
  "items": [
    {
      "type": "新模型发布＋开放技术报告＋独立产品核验＋客户试点",
      "source": "Salesforce、NVIDIA、ITPro",
      "title": "Salesforce用“抢先写入即零奖励”训练CRM模型，但客户仍只处于试点",
      "summary": "Salesforce Koa基于120B参数Nemotron模型，以合成的销售、客服、医疗行政和房地产流程做强化学习。训练不仅奖励正确工具调用，还专门构造“此刻必须先向用户确认”的关键状态：若Agent在约束未满足时执行不可逆写入，该轨迹奖励直接归零。模型已用于Salesforce内部Slack助手，并由Formula 1、Xero、Baxter Credit Union和UChicago Medicine等客户试点，但尚无生产收益数据。",
      "design": "Agent Script先描述角色、流程、工具及完成条件，生成器再扩展为带Persona的多轮任务；模拟用户、工具执行器和覆盖评委共同返回轨迹奖励。读取类调用可以继续，涉及状态变化的调用须等缺失信息补齐；训练还分别覆盖首轮与会话中段的约束状态，避免只会在固定位置停手。部署时模型通过Agentforce调用CRM工具，理论上继承平台权限。公开材料未说明客户侧字段级授权、人工批准、超时、重复写入去重和补偿事务，试点流程边界也未披露。",
      "evidence": "开放评测： Koa在Tau2Bench加权分为69.41，基础模型为68.64、GPT‑4.1为54.48；BFCL准确率66.63%，基础模型64.73；CRM Bench总分0.86，函数调用分由基础模型的0.71升至0.77，但仍低于部分最强闭源模型。确认部署： ITPro核实内部使用及多家客户试点。厂商主张： 自有权重和基础设施有利于控制与治理。局限： 训练用户、工具和评委大量依赖合成环境，模拟器可能同时塑造问题与奖励；没有真实任务量、错误写入、人工接管、时延、成本或客户结果，基准提升也不能证明试点产生业务价值。",
      "idea": "为CRM“更新销售阶段”建立约束状态测试：缺少客户确认、金额或负责人时只能提问，任何写入都判失败；字段齐全后仍须人工预览。用抢先写入率、缺口识别率、正确工具参数、重复写入、批准修改率、完成时间和每次合格更新成本验收。",
      "url": "https://arxiv.org/html/2609.15066",
      "relatedLinks": [
        {
          "label": "论文页面",
          "url": "https://arxiv.org/abs/2609.15066"
        },
        {
          "label": "Salesforce产品入口",
          "url": "https://www.salesforce.com/"
        },
        {
          "label": "ITPro独立报道",
          "url": "https://www.itpro.com/technology/artificial-intelligence/salesforce-teams-up-with-nvidia-to-launch-koa-a-dedicated-crm-reasoning-model"
        }
      ],
      "image": {
        "src": "/cases/salesforce-koa.jpg",
        "alt": "Salesforce Koa CRM推理模型论文首页",
        "caption": "论文视觉：通过关键约束状态训练CRM Agent等待确认后再执行写入。"
      }
    },
    {
      "type": "新预印本＋开放运筹优化澄清基准＋多轮停止评估",
      "source": "Cardinal Operations、上海交通大学",
      "title": "优化Agent能减少静默假设，但完整补齐约束需平均追问十次",
      "summary": "OR‑Clarify研究一个常被自动建模系统跳过的步骤：用户要求排班、路径或产能优化时，目标函数、业务限制和取舍往往没有说全。基准从完整问题中隐藏关键字段，让Agent在有限轮次内决定追问什么、何时可以开始建模，并同时统计字段恢复、静默假设和交互成本。结构化选项下，InterOPT把全部字段精确恢复率由基线的47.4%提高到63.8%，但平均问题数也由2.35升至10.04。",
      "design": "每题包含公开业务简报和仅评测端可见的目标、约束、决策范围及假设字段。第一阶段维护持续更新的缺口账本，将状态标为未解决或已询问；第二阶段从候选问题与“已经就绪”中选择下一动作，模拟用户只能依据绑定事实回答。最多20轮，到达上限即停止。它不生成或执行最终优化方案，也没有真实员工权限；生产系统应在核心缺口未关闭时禁止建模，并让业务人员确认恢复出的约束与停止决定。",
      "evidence": "预印本证据： 100个案例各运行五次，以案例为统计单位。Choice模式下InterOPT的核心字段精确恢复率为67.5%，MC‑D为50.6%；每次静默假设由0.692降至0.366。代价： 平均10.674轮、10.036个原子问题，明显高于MC‑D的3.258轮。开放问答中整体恢复仅49.2%，且Agent在98.8%的运行中宣布就绪，500次运行有203次、即40.6%被判过早停止。局限： 问题、隐藏字段和用户均为受控构造，主要实验使用同一模型；没有真人耐心、真实数据冲突、求解质量或业务收益，因此只能证明澄清策略的权衡。",
      "idea": "为Technician Scheduling或库存优化做20题澄清门：必须确认目标优先级、技能、班次、地理范围和不可违反约束，未闭合核心字段不得调用求解器；超过五问转调度员。以字段恢复、静默假设、平均问题数、放弃率、可行解比例和人工修正规则数验收。",
      "url": "https://arxiv.org/html/2609.05258",
      "relatedLinks": [
        {
          "label": "论文页面",
          "url": "https://arxiv.org/abs/2609.05258"
        },
        {
          "label": "完整PDF",
          "url": "https://arxiv.org/pdf/2609.05258"
        }
      ],
      "image": {
        "src": "/cases/or-clarify.jpg",
        "alt": "OR-Clarify优化任务澄清基准论文首页",
        "caption": "论文视觉：以缺口账本和多轮追问补齐优化目标与业务约束。"
      }
    },
    {
      "type": "ACL同行评审行业论文＋真实医疗通话数据＋动态RAG提示迁移",
      "source": "Infinitus Systems；ACL 2026 Industry Track",
      "title": "医疗IVR提示迁移达到82.21%，但证据仍是受控逐轮评测",
      "summary": "该系统自动把“导航到理赔部门”的既有提示迁移到“导航到患者福利部门”，减少每个付款方和任务重新手写Prompt的成本。它先从源任务与少量目标样本提取共同结构，再按IVR语义簇维护小型提示，并在运行时检索相似话术、可接受按键和提示。最终配置在真实医疗IVR语句上的逐轮准确率达到82.21%，高于人工提示的79.00%，提示复杂度最多降低80%。",
      "design": "输入是付款方IVR当前话术及已知患者、机构字段；模型输出等待、说话、DTMF按键或结构化数据输入。迁移模块分别检索源任务和目标任务样本，生成差异提示并检查虚构内容，再由DSPy优化；运行时先把话术分入语义簇，只注入相关指令和历史成功路径。规则先核对动作、按键及已验证同义表达，未命中才由受限类别的LLM评委判断。论文未披露通话身份验证、敏感字段最小化、连续失败转人、通话超时或错误按键后的恢复策略。",
      "evidence": "同行评审数据： 语料覆盖51个付款方号码、132类通话场景；源任务有438个话术—动作对，目标任务有1,447个，按场景分层切分。Cluster RAG迁移提示由75.92%优化至82.21%，相对最佳人工提示79.00%的差异达到`p<0.05`；普通迁移提示经SIMBA可由45.67%升至81.39%。局限： 论文明确结果来自受控离线及实验性评测，82%是逐轮正确率，不是整通电话到达目标部门的成功率；没有呼叫数量、平均节省分钟、错误披露、挂断率、人工接管或单位成本。数据与系统均由部署厂商提供，无法外部复现。",
      "idea": "为一个保险付款方的“查询理赔状态”做只读IVR原型：仅支持等待、四个按键和两类口头回答，身份证明与异常菜单转人员；提示按菜单类型拆分，历史成功路径可检索。以整通成功率、错误按键、平均到达时间、转人工率、敏感字段暴露和每通成本验收。",
      "url": "https://aclanthology.org/2026.acl-industry.136/",
      "relatedLinks": [
        {
          "label": "完整PDF与消融实验",
          "url": "https://aclanthology.org/2026.acl-industry.136.pdf"
        }
      ],
      "image": {
        "src": "/cases/healthcare-ivr-prompt-migration.jpg",
        "alt": "医疗IVR动态RAG提示迁移论文首页",
        "caption": "论文视觉：按付款方与菜单语义检索提示和历史成功路径。"
      }
    },
    {
      "type": "ACL同行评审论文＋开放政策合规数据集＋前置请求过滤评测",
      "source": "VMware Research；ACL 2026 Industry Track",
      "title": "自然语言政策过滤最高准确率仅55.11%，不能独立充当权限门",
      "summary": "该研究测试在用户请求进入高权限Agent之前，能否由本地小模型识别隐私泄露、提示注入、暴露Guardrail或访问受保护目标等违规。225条请求分别对应九项互不重叠的禁止政策，系统不仅要判断“违规”，还要指出具体违反哪一条。六个开源模型与多种提示方法中，最高准确率只有55.11%、最高宏F1仅0.3994，说明自然语言分类器尚不足以单独批准工具执行。",
      "design": "请求先送入本地合规层，逐条与九项政策比较；最简单的方法直接分类，更复杂的方法会把政策改写为“是否关联禁止动作”、把请求扩展成执行计划，或分别生成合规与违规论证再裁决。通过的请求才应进入主Agent，命中时返回具体政策供用户修改。论文只评估文本分类，没有连接真实IAM或工具。生产中应让确定性数据标签、目的地清单和权限规则优先执行；模型仅处理语义灰区，冲突、低置信度或高风险外发一律停止并交政策所有者。",
      "evidence": "开放证据： 九项政策各配25条相关合规或违规请求，共225条；六个模型从1B到120B均接受相同评测。120B模型简单提示准确率55.11%、宏F1为0.3994；1B与8B模型某些配置也达到53.33%准确率，但没有任何模型或方法同时取得最佳真阳性、真阴性和漏报表现，复杂的双论证方法整体未优于简单提示。局限： 数据由单一作者以技术公司情境构造，没有真实员工分布、模糊政策冲突或对抗改写；准确率还混合“是否违规”和“政策编号是否正确”。结果证明任务困难，不能证明小模型已经适合生产拦截。",
      "idea": "为内部AI上传入口建立混合政策门：正则和数据标签确定性阻止密码、客户ID与未批准域名，模型只判断五类语义灰区；所有模型拒绝均允许人工申诉。以严重漏报、正常请求误拒、政策定位准确率、申诉推翻率、复核分钟数和每千次过滤成本验收。",
      "url": "https://aclanthology.org/2026.acl-industry.21/",
      "relatedLinks": [
        {
          "label": "完整PDF与逐模型结果",
          "url": "https://aclanthology.org/2026.acl-industry.21.pdf"
        },
        {
          "label": "开放数据集与代码",
          "url": "https://github.com/PedroCV/policy-compliance-requests-AI"
        }
      ],
      "image": {
        "src": "/cases/policy-compliance-filter.jpg",
        "alt": "自然语言政策合规过滤论文首页",
        "caption": "论文视觉：在高权限Agent前识别违规请求及对应政策。"
      }
    }
  ],
  "projectIdeas": [
    {
      "title": "Ask‑Before‑Act Gate",
      "description": "选择CRM更新或Technician Scheduling，只定义五个必须确认的核心字段；Agent维护缺口账本，字段未闭合时只能追问，达到问题上限即转人，写入必须预览。以静默假设、抢先动作、平均问题数、人工接管和端到端完成率验收。",
      "tags": [
        "约束确认",
        "缺口账本",
        "人工预览"
      ]
    },
    {
      "title": "Hybrid Policy Admission Layer",
      "description": "在高权限Agent前组合确定性敏感数据规则、目的地白名单和语义政策分类；模型不得单独放行外发或写入，请求与命中政策均留审计记录。以严重漏报、误拒、规则—模型冲突、申诉推翻、P95时延和每千次成本形成发布门。",
      "tags": [
        "确定性规则",
        "语义分类",
        "人工申诉"
      ]
    }
  ],
  "contentHash": "49554e06868a72a9"
}
