{
  "issue": "ISSUE 020",
  "date": "2026.09.14",
  "thesis": "模型能力提升不能代替状态管理与边界控制；生产系统需要在模型之外过滤可见数据、保存业务状态、校验确定性字段，并用真实人工接受率或业务对照决定何时自动执行。",
  "takeaways": [
    "在检索前决定哪些信息可被看见",
    "跨轮次保存哪些业务假设仍成立",
    "根据真实纠正决定哪些动作可无人执行",
    "把数字、格式和禁用承诺交给确定性规则"
  ],
  "contrarian": "CI‑Work公开资产但使用合成环境；DQA使用真实记录却只有回放实验；选择性客服给出较大规模生产A/B，但关键质量分母保密；REPO证明回复与谈判成功提升，却没有最终利润、投诉和关系损害数据。最值得复制的不是某个模型，而是“数据可见范围—结构化状态—动作级阈值—最终业务结果”这条可分别测量的控制链。",
  "items": [
    {
      "type": "ACL同行评审行业论文＋开放隐私基准与代码",
      "source": "华中科技大学、Microsoft；ACL 2026 Industry Track",
      "title": "CI-Work发现：企业Agent任务完成得越好，隐私风险可能越高",
      "summary": "CI-Work测试企业Agent能否在完成任务时，只向正确接收者传递必要内容，而不泄露同一检索结果中的敏感信息。125个场景覆盖向上、向下、平级、跨部门和对外五类信息流，包含法律、HR、财务、安全及战略资料。九个前沿模型的规范违反率为15.8%–50.9%，泄露率最高26.7%；任务所需信息传递越完整，隐私风险反而常越高，说明通用“更强模型”并不自动等于更可靠的企业权限判断。",
      "design": "每个场景定义发送者、接收者、任务和传递原则，并配置四条必要资料与四条敏感资料；ReAct Agent从模拟企业数据中检索后生成最终动作。评估器分别计算必要信息传递率、敏感内容泄露率及是否发生规范违反。数据集用25个人工种子和100个合成种子生成，GPT‑5.2辅助扩充与评分，抽样再由企业员工核验。它是评估环境，不含真实目录权限、字段脱敏或审批流；生产应用应在检索前按角色过滤，而非先把全部内容交给模型再要求其保密。",
      "evidence": "确认数字：基准含125个场景、1,000条上下文记录和九个模型；DeepSeek‑R1规范违反率最低15.80%，Grok‑3最高50.87%，泄露率最高26.66%。信息传递率与泄露、违反的Pearson相关系数分别为0.40和0.39，均达到p<0.05。GPT‑5加入隐私提示后，违反率由27.83%降至21.31%，但必要信息传递率由93.04%降至81.01%。局限：场景和资料均为合成或人工编写，自动评委也参与数据生成；25例人工抽检中部分标签一致率仅82.5%。这些结果证明Prompt与模型扩展不足以稳定保护上下文隐私，不能推算真实企业事故率或满足特定法规。",
      "idea": "为HR或采购问答建立“接收者感知检索门”：选取三种角色、50个问题及必要／敏感字段标签，先按身份过滤，再生成带引用答案；任何标签不明内容转给资料所有者。比较过滤前后的任务完成率、敏感字段暴露率、正确拒绝率、人工升级率和响应时间。",
      "url": "https://aclanthology.org/2026.acl-industry.103/",
      "relatedLinks": [
        {
          "label": "完整PDF与实验表",
          "url": "https://aclanthology.org/2026.acl-industry.103.pdf"
        },
        {
          "label": "数据与代码",
          "url": "https://aka.ms/ci-work"
        },
        {
          "label": "Microsoft Research项目页",
          "url": "https://www.microsoft.com/en-us/research/publication/ci-work-benchmarking-contextual-integrity-in-enterprise-llm-agents/"
        }
      ],
      "image": {
        "src": "/cases/ci-work.jpg",
        "alt": "CI-Work企业信息流隐私基准论文首页",
        "caption": "论文视觉：任务信息传递越完整，敏感内容泄露与规范违反风险可能同时上升。"
      }
    },
    {
      "type": "企业研究预印本＋真实匿名工单回放评估",
      "source": "Amazon",
      "title": "IT支持RAG保存根因竞争状态，轨迹成功率由41.3%升至78.7%",
      "summary": "DQA针对一个常被普通RAG处理成“继续搜索”的小问题：用户只描述模糊故障时，系统怎样跨多轮保留互相竞争的根因。它不把每轮检索到的工单独立塞入Prompt，而是按最终解决原因聚类，维护候选根因、症状、知识文章和证据权重，再决定询问、调查还是给出修复建议。在150个匿名企业IT案例回放中，轨迹成功率达到78.7%，相较多轮RAG基线的41.3%明显提高，平均轮数也由8.4降至3.9。",
      "design": "历史已解决工单先提取根因描述、症状和解决步骤，并以Embedding聚类。每轮将当前对话改写成独立查询，检索相似工单，按根因聚合计数与代表案例，通常压缩到不超过五个候选簇；结构化状态持续保存工作假设、症状、KB文章和候选权重。模型据此选择澄清问题、调查步骤或解决方案，新证据到来后重新检索并更新状态。论文未披露具体生成模型、用户身份与工单权限过滤、低置信度阈值、人工接管、执行工具或错误修复回滚，因此系统证据限于建议式诊断。",
      "evidence": "研究证据：150个真实匿名IT支持交互覆盖硬件、软件配置、访问管理、认证和企业应用，且权限类故障占多数；每种方法独立运行三次，以整条轨迹是否识别正确根因为标准。DQA平均成功率78.7%，多轮RAG为41.3%，平均对话轮数分别为3.9和8.4；聚合设计还能在10万级历史案例中仅向生成器传递少量根因摘要。局限：这是按既有交互重放的离线实验，用户后续回答和真实客服行为已固定，不能测量动态追问、误操作、解决时长或满意度。数据、聚类质量、Token成本和分组结果未公开，且作者均来自Amazon，尚无独立复现或线上A/B证据。",
      "idea": "为内部VPN故障做单问题诊断器：只维护五类根因和十项调查动作，系统显示候选权重及支持工单，不直接改账户；两轮无信息增益或根因并列即转工程师。以正确根因率、平均轮数、无效提问、错误修复建议、接管率和每案成本验收。",
      "url": "https://arxiv.org/abs/2604.05350",
      "relatedLinks": [
        {
          "label": "完整PDF与算法",
          "url": "https://arxiv.org/pdf/2604.05350"
        }
      ],
      "image": {
        "src": "/cases/dqa-it-support.jpg",
        "alt": "DQA企业IT故障诊断研究论文首页",
        "caption": "论文视觉：结构化保存候选根因与证据权重，使多轮诊断不再退化为反复搜索。"
      }
    },
    {
      "type": "ACL同行评审生产论文＋两组线上A/B＋Human-in-the-loop部署",
      "source": "T‑Tech；ACL 2026 Industry Track",
      "title": "客服Agent从Copilot反馈学习拒绝：自动完成45%会话，人工时间降39%",
      "summary": "该系统把企业BPM客服自动化分成日志、Copilot和选择性自治三阶段。它先从人员点击、填表、发信和结案轨迹学习下一步动作，再利用客服对建议的接受或纠正训练Critic；只有达到阈值的关键动作才在后台执行，不确定状态立即交回人员，并能从人工修改后的界面继续。新流程约两周即可进入选择性自动化。生产实验中45%的会话无需人工介入，平均人员活跃时间下降39%，而盲评解决正确性未显著下降。",
      "design": "系统把聊天、客户资料、当前流程及可操作控件序列化为Schema化JSON，Qwen2.5‑Instruct‑7B策略模型预测导航、选项、填表、消息或结案动作；Critic依据Copilot阶段的接受／覆盖反馈评估关键动作。普通界面动作可直接执行，发信和结束会话等关键动作须超过按业务精度校准的阈值；校准期的最终结案仍由人确认。新控件、分布漂移或分片指标越界时关闭该流程的自动化，退回Copilot并收集新纠正，滚动训练后再上线。训练数据通过实体遮蔽和字段删除处理。",
      "evidence": "生产证据：两项受控A/B各约1.5万客户／组。相较纯人工，人员活跃时间由227.37秒降至139.15秒，下降39%；相较脚本化聊天机器人，由124.67秒降至104.72秒，下降16%，均为p<0.05。系统端到端自动完成45%的会话，解决正确性没有显著下降。17万历史样本加入4万条被拒纠正后，困难样本准确率由14.88%升至25.72%；但9,370次拒绝中37.2%只是可接受动作被人员按偏好否决。局限：公司、业务、实验周期、绝对正确率和严重错误未披露；无人介入会话还包含等待超时后未回复的用户，可能抬高自动化率，无法证明长期客户体验或净成本。",
      "idea": "为客服BPM中的“账户资料补全”建立三阶段试点：首周只记录，次周建议动作，随后仅自动点击和填充；外发消息、权限修改与结案继续人工确认。测量关键动作精度、自动覆盖率、纠正率、人员活跃秒数、错误结案、漂移回退次数和客户复联率。",
      "url": "https://aclanthology.org/2026.acl-industry.141/",
      "relatedLinks": [
        {
          "label": "完整PDF与生产实验",
          "url": "https://aclanthology.org/2026.acl-industry.141.pdf"
        },
        {
          "label": "预印本",
          "url": "https://arxiv.org/abs/2604.23855"
        }
      ],
      "image": {
        "src": "/cases/selective-autonomy.jpg",
        "alt": "选择性客服自动化生产实验论文首页",
        "caption": "论文视觉：从Copilot接受与纠正反馈校准动作级阈值，再逐步开放低风险自治。"
      }
    },
    {
      "type": "ACL同行评审生产论文＋专家评估＋9,653次真实对话A/B",
      "source": "Alibaba、伦敦玛丽女王大学；ACL 2026 Industry Track",
      "title": "OTA价格谈判Agent提高成交率，但成功仍只有25.26%",
      "summary": "REPO用于OTA业务人员向酒店经理进行多轮降价谈判。任务要求模型区分售价、酒店到手价、竞品价和目标价，依次执行标准流程，同时不得承诺未授权服务或泄露内部术语。训练没有只依赖单一偏好模型，而是将人工偏好、LLM对说服方式及SOP的评分、正则表达式对数字和禁用词的检查组合为受限奖励。生产A/B中酒店回复率由46.72%升至58.86%，谈判成功率由19.32%升至25.26%。",
      "design": "Qwen2.5‑32B基础模型接收多张价格调整工单、历史对话和当前SOP阶段，生成下一轮谈判话术。偏好Reward Model提供主要信号；Reward Judge评估语气、说服方式、流程完整性和进展；可审计的Reward Function检查价格对应关系、格式、重复确认和内部词泄露。辅助奖励经过裁剪后只调节主奖励，减少奖励劫持。部署发现系统性失败时，团队修改Judge规则或增加正则，再继续训练。论文未披露实时人工监听、商户拒绝后的停止次数、调用权限、投诉处置或错误报价撤回机制。",
      "evidence": "同行评审证据：三名专家评估30段线上完整对话和45个历史坏例，REPO平均评分4.63，比GRPO高0.33；至少出现一次优秀回复的对话占66.67%，提升23.34个百分点；坏例修复率93.33%，其中无新增问题的修复占75.56%。生产证据：9,653次真实客户对话中，回复率提高12.14个百分点，谈判成功率提高5.94个百分点，均为p<0.001。局限：A/B未披露分组、周期、价格让步幅度、预订转化、酒店留存、投诉或人工成本；“回复”和“达成降价”只是代理业务指标。全部线上证据由部署团队报告，且仅覆盖单一中文OTA谈判任务，不能证明更广泛销售Agent安全有效。",
      "idea": "为供应商续约做“只生成话术”的谈判助手：限定一种折扣请求，规则校验金额、底价、有效期和禁用承诺，采购人员确认后外发；达到三轮、对方拒绝或价格越界即停止。以回复率、合规通过率、数字错误、人工修改率、成交率、关系投诉和实际节省金额验收。",
      "url": "https://aclanthology.org/2026.acl-industry.34/",
      "relatedLinks": [
        {
          "label": "完整PDF与Reward设计",
          "url": "https://aclanthology.org/2026.acl-industry.34.pdf"
        },
        {
          "label": "预印本",
          "url": "https://arxiv.org/abs/2510.04214"
        }
      ],
      "image": {
        "src": "/cases/repo-negotiation.jpg",
        "alt": "REPO OTA价格谈判Agent生产研究论文首页",
        "caption": "论文视觉：人工偏好、模型评委与确定性规则共同约束多轮价格谈判。"
      }
    }
  ],
  "projectIdeas": [
    {
      "title": "Role-Filtered Diagnostic RAG",
      "description": "选择VPN或采购政策这一窄领域，先按用户角色过滤资料，再维护最多五个候选假设和证据变化；系统只给建议，不执行修改。以敏感字段暴露率、正确根因率、平均轮数、转人工率和解决时间验证。",
      "tags": [
        "角色过滤",
        "候选假设",
        "诊断RAG"
      ]
    },
    {
      "title": "Correction-Calibrated Action Gate",
      "description": "为一个已有Copilot收集两周“接受／纠正”记录，按动作风险分别校准自动执行阈值；只有低风险、高精度动作进入后台，高风险动作保留确认。以自动覆盖率、关键动作精度、人工秒数、错误状态和回退次数验收。",
      "tags": [
        "纠正反馈",
        "动作阈值",
        "选择性自治"
      ]
    }
  ],
  "contentHash": "fc99bc373230ad2b"
}
